id,name,desc,upgradeType,value,cost
wrath,Гнев,"Людей становится слишком много. Невроз увеличивается, вспышки гнева участились.",Active,10,10
gluttony,Чревоугодие,"Перепроизводство, маркетинг и низменные инстинкты берут своё. Люди стали есть больше, чем им нужно.",Passive,100,100
Lust,Похоть,В наше время такого не было! По телевизору один разврат...,Passive,1000,1000
pride,Гордость,"Они слишком горды, чтобы извняться и прощать.",Active,10000,10000
greed,Жадность,Никому и ничего!,active,100000,100000
sloth,Безделье,Лень превратила их в овощей.,Passive,1000000,1000000
envy,Зависть,В душах копится желчь и злоба. ,Passive,10000000,10000000